{
  "type": "client.hello",
  "request_id": "018f3e58-78c0-7d8e-a701-3a6ca29a0041",
  "protocol": {
    "major": 1,
    "min_minor": 0,
    "max_minor": 0
  },
  "client": {
    "name": "xenoteer-rust",
    "version": "0.1.0"
  },
  "resume": {
    "desktop_id": "018f3e58-78c0-7d8e-a701-3a6ca29a0001",
    "desktop_generation": "018f3e58-78c0-7d8e-a701-3a6ca29a0002",
    "event_sequence": "1042"
  }
}
